9be86ddf-1d0e-4970-bc98-c4a5dfe00551;ALVES E NAVARRO SHELL;Estrada Guavirutuba, 1747 - Vila Bom Jardim, São Paulo;-23.686747;-46.753585
4dfd37a9-b504-4761-9b59-2572f5460c2b;COMERCIAL AOKI;Rua São Gonçalo do Rio das Pedras, 897 - Vila Mara, São Paulo;-23.4899096;-46.42072410000001
66bec215-2e36-4c62-bd28-046d2a35d0cb;CENTER PIVA;Rua Diogo Antônio Feijó, 23 - km 18, Osasco;-23.4843459;-46.8049944
ff176689-1b9c-4350-9644-5c49296d9996;PAD E CONF FLOR DE QUITAUNA;Rua General Florêncio, 1436 - São Pedro, Osasco;-23.5350897;-46.8147414
69d67ca9-877b-4b9e-b444-d0b860407494;MONICA VIEIRA;Rua Theda Figueiredo Rega, 30 - Jardim Elvira, Osasco;-23.5019602;-46.8001115
52938078-dcb3-450d-a6d4-dd181ccd02c7;MIRNA LUCIA;Praça Vinte e Um de Dezembro s/n, BOX 13 - Centro, Osasco;-23.527661;-46.7788724
1b253094-4ef3-4a40-a209-95145dc731c7;PADARIA ELITE;Rua São Paulo da Cruz, 368 - Santo Antônio, Osasco;-23.5563348;-46.7958538
c54b8b05-5d33-4e79-a639-75520f5281e0;MANZANEDA;Rua Mauro de Araújo Ribeiro, 69 - Cidade D'Abril, São Paulo;-23.453475;-46.7488693
27b837f1-78af-4052-8d64-90bfefc6a212;EMPORIUM COMPRE FACIL;Alameda Eduardo Prado, 165 - Campos Elíseos, São Paulo;-23.5292898;-46.6470847
26ba303b-b06b-454f-bf18-6a82f3a191bd;MERCADO NOVO HORIZONTE;Rua Luís Delfino dos Santos, 22 - Jardim das Rosas (Zona Sul), São Paulo;-23.6574724;-46.7907671
7025d0ab-9ed9-4e6a-b427-36898cb77f85;AMOR AOS PEDACOS;Avenida Ibirapuera 3103, 3103, LOJA 108 - Indianópolis, São Paulo;-23.6102554;-46.6666907
fe6bfbf9-dd24-4be9-a6d9-99a3196a76a4;CENTER CARNES CAROLINE;Rua São Silvestre, 486 - São João Clímaco, São Paulo;-23.6236602;-46.5935285
ffd172d2-700b-4898-b718-a5e74409ab8a;ORQUIDEA OURO;Avenida Mascote, 542 - Vila Mascote, São Paulo;-23.6484988;-46.6675335
72459a29-fcc9-47cd-87ce-1814659b5c2a;MERCEARIA BELA VISTA;Avenida Doutor Alberto Jackson Byington, 415 - Vila Menck, Osasco;-23.4998444;-46.7699199
5038ef76-6c6b-4cc3-b7b3-f555650789cc;MINI MERCADO MC;Rua Ferrúcio Castagna, 43 - Jardim Rubilene, São Paulo;-23.7020847;-46.6347416
bd5aeec7-667a-4d08-b1e8-368d97028097;ISABELLA PAES E DOCES;Avenida João Ventura dos Santos, 2553 - Baronesa, Osasco;-23.494023;-46.8028018
9d869e5e-3cb7-420b-b6ed-f6ea32061bbe;PAO MANIA;Rua Espedito Izídio Andrade, 30 - Metalúrgicos, Osasco;-23.565495;-46.81428289999999
ff3aeacb-f850-4528-bb9f-5e4c1bda9840;P & G SORVETERIA;Rua João Padilla, 127 - Parque da Mooca, São Paulo;-23.5827603;-46.59212369999999
ca65738c-7b38-4bd3-8c0c-9335b4d74e73;YPEAMAN PAES E DOCES;Rua Monforte de Lemos, 5 - Jardim Umuarama, São Paulo;-23.6419762;-46.7665781
baba5363-4984-4d03-8939-617e5669c50d;JAILTON SENA MELO;Rua Antônio Bernardo Coutinho, 56, LOJA 1E,2D - Centro, Osasco;-23.5308815;-46.7760038
5f8cd510-ae61-458f-b479-f9d9a2d23a47;PAES E DOCES ROKADY;Avenida Hildebrando de Lima, 1316 - km 18, Osasco;-23.5319195;-46.8038075
1f729ee3-970c-4af3-9c03-6db5c09800b4;ALFA MERCADO E PADARIA;Rua Achiles Belline, 843 - Padroeira, Osasco;-23.553223;-46.8093998
62b9d396-3a6a-40f4-ac03-f0021e3859e7;KELLY REGINA DOS SANTOS MESSIAS;Rua Joaquim Gutier Navarro Filho, 98 - Bonança, Osasco;-23.4898962;-46.7900492
6665818b-0958-4331-8754-0025ddc81a4b;PADARIA GUERREIRA;Rua Joaquim Gutier Navarro Filho, 3 - Bonança, Osasco;-23.4902221;-46.7893356
b7f07c09-8f91-4b1c-8d81-cfa7481bae3c;MERCADO FRANSANO;Rua Francisco Bispo da Cruz, 51 - Jardim D'Abril, Osasco;-23.5629342;-46.7761785
5e97f3e7-626d-464d-9ab9-d8a34aa1a8b4;REAL PIZZARIA;Avenida Professor Alfonso Bovero, 2 - Sumaré, São Paulo;-23.545059;-46.6821827
f240a01e-4a99-4a21-a2c1-650ac0413c33;BOMBONIERI FERREIRAS;Rua Herbart 47, 47, BOX 89/90/91 - Lapa, São Paulo;-23.5193882;-46.7018484
378a2487-9464-4033-9891-5fa882fb7e50;ORQUIDEA MAXIMA PAES;Rua Vigário Albernaz, 500 - Vila Gumercindo, São Paulo;-23.6057553;-46.6231583
4f9f4ecd-627a-4439-bafb-bcacc6830cb3;MERCADO VIDA;Rua Colina do Oeste, 246 - Portal D'Oeste, Osasco;-23.4891601;-46.8021882
4af16cbe-5512-4717-a5e1-45306362e353;MINI PANIFICADORA E LAN;Rua Fortaleza, 71 - Rochdale, Osasco;-23.5052087;-46.7816889
c42082e8-26ad-4d5b-bcae-e767c5111b06;LANCHONETE LIMA RECANTO SABOR;Rua Guido Portumati, 274 - Jardim Elvira, Osasco;-23.5001081;-46.7961587
1167faeb-025d-4308-bcdc-ab9ed62c5760;ESTADO LUSO;Avenida Águas de São Pedro, 298 - Vila Paulicéia, São Paulo;-23.4873699;-46.6143148
3937393c-fa17-4b53-a212-9a8e94c60804;VILA DOCE;Rua Domingos de Morais, 1000 - Vila Mariana, São Paulo;-23.5853078;-46.6369912
925db77b-83db-4408-bc13-cc416e38ffc3;CASA DE CARNES DAYTONA;Rua Doutor Luiz Migliano, 1024 - Jardim Caboré, São Paulo;-23.6135935;-46.7427491
914de76d-7d10-4b5c-a4c3-a411b421a232;PAO E COMPANHIA;Rua Joichi Yamaji, 238 - Metalúrgicos, Osasco;-23.5653336;-46.8150476
02db3c95-5521-40ad-8063-094870b9d466;PAO MANIA;Avenida Almirante Negro, 257 - Bandeiras, Osasco;-23.5556738;-46.8163859
6fabb5c1-3ef4-4f10-9325-e9b4f191a966;DOCERIA FANI;Rua Itinguçu, 697 - Vila Ré, São Paulo;-23.5241545;-46.5080894
696ec22b-1047-4169-b7cf-cf1dac6b5ccf;IRMAOS MORAIS;Avenida Maria Luiza Americano, 1915 - Cidade Líder, São Paulo;-23.5655908;-46.4746688
c8dceb18-5199-4fdc-9013-4a7582828967;CASA DO NORTE EDU GUEDES;Rua Irlanda, 160 - Rochdale, Osasco;-23.5136358;-46.7832753
da04d856-e953-4634-b9fb-b1343381b84d;NILFRAN;Rua Moacir Salles D'Ávila, 776 - Vila Menck, Osasco;-23.5020978;-46.7630761
66bdc7d2-4269-44e3-8844-3e0d4cef136c;ROVIER;Rua André de Almeida, 1190 - Cidade São Mateus, São Paulo;-23.5946277;-46.4832928
a53e6c61-0d67-4760-bcc3-cc761af09db1;AKITEM;Rua Colômbia, 211 - Jardim D'Abril, Osasco;-23.5590768;-46.7779365
648ef2bc-4e7a-482b-b7c9-fc3343d57c98;DENGOSA;Rua Canário, 669 - Moema, São Paulo;-23.601545;-46.6670951
87770b4c-ef22-457b-85ee-19ba182d2d72;MERCADINHO MM PEREIRA;Rua Agostinho Navarro, 1080 - Conceição, Osasco;-23.5806004;-46.7976675
9e70d85e-9be9-44d1-9087-afc6ad5dcd6f;COMERCIO VAREJISTA DE DOCES ISSEI;Rua Antônio Lopes Marin, 85, CASA VERDE - Casa Verde, São Paulo;-23.5101894;-46.6595491
810a4ed7-0a6a-4a4d-a863-6215c35644df;SUPERMERCADO CISPER;Avenida Olavo Egídio de Souza Aranha, 663 - Parque Císper, São Paulo;-23.5025917;-46.4940608
d56d1fe9-ac56-403d-aede-8d735d883201;COM ALIM E ROTISSERIE;Rua Itapiji, 61 - Vila Libanesa, São Paulo;-23.5748475;-46.5787145
ec63bc1f-95a4-4507-a579-ed059ad3c2b6;CENTER CARNES SIMONE;Rua João da Cruz e Sousa, 318 - Jardim das Rosas (Zona Sul), São Paulo;-23.6593836;-46.7888425
3a657944-ac2d-43d2-8707-c22c55eb2e7a;MERCADAO DE CARNES SIAO;Rua Elza Fagundes Moraes, 671 - Jardim Roberto, Osasco;-23.5443074;-46.8075297
45c33eb3-ee7d-40a3-9d9c-3af5e0b50d88;OPUS;Rua Arizona, 1319 - Cidade Monções, São Paulo;-23.6107042;-46.693513
4946e49f-6993-41cb-8c4f-1689cb726025;BANDEIRANTES V PAES E;Rua José Neves, 585 - Vila São Paulo, São Paulo;-23.6576701;-46.6744478
3b71f747-e69a-4775-a4f2-9600313a6163;CENTER CARNES TORRES;Rua Fernão Mendes Pinto, 1529A - Parque Boturussu, São Paulo;-23.4940595;-46.4901031
daa236ea-e1af-43f8-b48c-25d36dcc8361;CASA DE CARNES OLIVEIR;Avenida São José, 299 - Ayrosa, Osasco;-23.5172361;-46.77165
928ad045-5ce6-4c7e-82b0-fca5d3f392c3;J CELIO;Rua Homero Sales, 55 - Parque São Domingos, São Paulo;-23.5063066;-46.7411428
ea49aa98-2b88-40c8-9e35-d36f2ac4bade;AUTO POSTO PAES DE BAR;Avenida Paes de Barros, 1064 - Mooca, São Paulo;-23.5642363;-46.59683870000001
e34574f7-acf8-418b-9d5b-bc47f64f8f31;DOURADO E SILVA LTDA;Rua do Outono, 466 - Vila Itaberaba, São Paulo;-23.4606372;-46.6953003
42eca4d9-a99c-42e5-b672-cc704d7e87b4;PAES E DOCES SALEME;Avenida João de Andrade, 1644 - Santo Antônio, Osasco;-23.5604348;-46.7991557
c512541a-689e-4d54-b01f-6b4e6854aad4;ANJO ANIEL FRIOS;Praça Canárias, BOX 4 - Vila Formosa, São Paulo;-23.566445;-46.545875
b98b5172-2ff0-42f0-9ade-0fe96954d44e;XFIT;Avenida dos Autonomistas, 896, LOJA 226 - Vila Yara, Osasco;-23.5438354;-46.7627798
629563b7-f768-4fc1-85a4-5302b4968e13;CECILIA;Rua Pardal, 16 - Ayrosa, Osasco;-23.5155795;-46.7595344
02a28b6f-6984-4102-8e16-8c91ae6028ce;TACINI PANIFICADORA;Rua Anhangüera, 523 - Piratininga, Osasco;-23.5193507;-46.7949318
461f044a-90f2-42ae-925f-dc8129e7e525;CRISTALLO-HIGIENOPOLIS;Avenida Higienópolis, 68, LOJA 352 - Higienópolis, São Paulo;-23.5449892;-46.6527003
91af170f-b584-4362-b9cf-3cec1a21357f;CANTINA NOSSA SENHORA DOS REMEDI;Avenida Nossa Senhora dos Remédios, 348 - Remédios, Osasco;-23.5200188;-46.7540819
ef144799-602e-4a1d-9dae-ebddc5f99e6d;COM CEREAIS QUATRO ESTRELAS;Rua Herbart 47, 47, BOX 107 - Lapa, São Paulo;-23.5193882;-46.7018484
7ec64787-60e1-40e1-a5cd-f4f4291dd30b;CASA DO NORTE LC;Rua Doutor Miguel de Campos Júnior, 2E - Portal D'Oeste, Osasco;-23.4914362;-46.8003187
73b1c3a1-2884-463d-b122-44c0eca294b3;MERCADINHO LASTRAL;Avenida Raquel Alves Moreira, 14 - Parque Santo Antônio, São Paulo;-23.6674924;-46.7527738
ac0931b0-2d9f-4dcb-9992-230e031cd0e2;R M RAMOS MERCADO E PANIFICADORA;Avenida General Pedro Pinho, 73 - Pestana, Osasco;-23.5312269;-46.80191600000001
f17730b7-0e29-4369-8b58-9c25638de019;MERCADINHO KM 25;Avenida Piero Tricca, 25 - Jardim Santa Fé (Zona Oeste), São Paulo;-23.4308465;-46.7907175
c310a084-4ef6-4d8b-b8f3-26b886d0cebd;FLORISVALDO SILVA DOS SANTOS CAR;Rua Clotilde Galesi, 30 - Vila Osasco, Osasco;-23.5444182;-46.7767354
a071eb87-a3df-409f-9f59-692958f5c3e4;RYMA MINI MERCADO;Avenida Roland Garros, 516 - Jardim Brasil (Zona Norte), São Paulo;-23.4815018;-46.5821983
049147f4-3312-49e9-88db-81d014a23499;MERCADO ELI;Rua Capistrano de Abreu, 669 - Jaguaribe, Osasco;-23.5577685;-46.7919083
b9910645-73ab-49ba-993b-f7ee3d402c60;CENTRO AUT.VL.FORMOSA;Avenida Doutor Eduardo Cotching, 2203 - Vila Formosa, São Paulo;-23.5672167;-46.5420097
85f41b89-0570-4659-a5f3-c44cc26ac47f;APETITE FRANGO;Rua João Ramalho, 1228 - Perdizes, São Paulo;-23.5331629;-46.6769975
4b057063-63a4-4d37-8f4f-c8366e4358d4;SUPERMERCADO MARINHO;Rua Perry Salles, 17 - Conjunto Habitacional Turística, São Paulo;-23.4745294;-46.7592021
45812e1c-e74c-44f5-a0a6-96f2802b49e0;RAPOSO TAVARES;Avenida Valter Boveri, 240, LOJA01 - Bussocaba, Osasco;-23.568493;-46.79193979999999
752ace70-938d-4941-b0dd-cbdec675b29c;VILINHA;Rua Tito, 837 - Vila Romana, São Paulo;-23.5284572;-46.7000134
cc54eaf4-70ce-4f03-a3ac-49f36359f34e;ODAIR SILVA DUTRA;Avenida Sarah Veloso, 1142 - Veloso, Osasco;-23.5667305;-46.8082781
921035dc-972b-4352-aa54-6d741df5284e;REGINA PIZZA;Rua Narciso Sturlini, 732 - Centro, Osasco;-23.5453737;-46.7743405
f362b854-0c1d-417d-b2d2-c4060c409e69;RECANTO;Rua Manaus, 1 - Rochdale, Osasco;-23.505019;-46.777085
3980beb0-b320-4773-9f38-370dac6c1798;SEVILHA PAES E DOCES;Alameda Barros, 801 - Santa Cecília, São Paulo;-23.5357386;-46.6587475
ebe74401-de84-4fba-b2ea-7becc59c9d11;CASA DE CARNES NOVORIZONTINO;Avenida Paulo Guilguer Reimberg, 2305 - Jardim Novo Horizonte, São Paulo;-23.7757104;-46.6972752
ed2bd4f9-8e09-408b-ad53-c7430ebf4d39;FRANCISCO VALDIANO DA SILVA;Rua Francisco de Paula Alvarenga, 316 - Ayrosa, Osasco;-23.5110592;-46.7707354
bdd1d24f-57c9-4d61-88b6-30439cc2cece;SUPERMERCADO YAMASHITA;Rua Agostinho Navarro, 668 - Conceição, Osasco;-23.5776739;-46.79892400000001
408467ce-3434-481f-ab04-4cf491634896;DELICIAS DO MUTINGA;Avenida Presidente Médici, 2317 - Vila Menck, Osasco;-23.505407;-46.7684414
113f1ce4-6ad0-4d09-8bd5-a5e1746ce0f1;FLORATTA PAES E DOCES;Avenida das Flores, 579 - Jardim das Flores, Osasco;-23.534185;-46.7909047
5f163fe3-3f75-4323-a6c5-660c12ddd288;PADARIA CONF AGUA VIVA;Avenida Amador Bueno da Veiga, 4346 - Penha de França, São Paulo;-23.5146025;-46.5062411
3965e80b-d52d-40d7-a474-1b99e05157cc;MERCADO NOVA UNIAO;Avenida Juscelino Kubitschek de Oliveira, 1958 - Portal D'Oeste, Osasco;-23.4931921;-46.7973554
f718e6b8-d4c0-4353-96b6-3b8d0ba8b691;PAES E DOCES GATO DOURO II;Avenida Doutor Guilherme Dumont Villares, 1155 - Jardim Londrina, São Paulo;-23.6136749;-46.7412625
d552d484-9255-49b8-ae5c-1fcce22d5a4e;JOSE GUTEMBERG HERCUL;Avenida Juvenil, 46 - Conceição, Osasco;-23.5783431;-46.8035513
b21bdbd4-28b1-4237-b0cd-bdee81685f79;BOCCARICCA SAPORIDITALIA;Rua Silva Bueno, 2109, BX 6 - Ipiranga, São Paulo;-23.5972924;-46.6004157
a37d0fd4-ba66-4254-ac64-75f2697643c6;RESTAURANTE DA VOVO;Avenida João Ventura dos Santos, 3111 - Baronesa, Osasco;-23.4944438;-46.8084074
5c2e56e4-89c5-4bac-8d0b-dcfd6ec23240;H P C;Rua São Teodoro, 1632 - Vila Carmosina, São Paulo;-23.5567764;-46.44577959999999
4725f4a0-7585-46c5-bcd2-8cf4a6c885d1;FL FERNANDES LOPES COM;Avenida Cupecê, 5168 - Jardim Prudência, São Paulo;-23.6791841;-46.6406127
a60cdc67-7183-4c05-a1b6-c9accf087b8e;DARLEI PROD  NATURAIS;Estrada de Itapecerica, 4940 - Jardim Vista Linda, São Paulo;-23.659615;-46.775624
a5380266-e0b7-4821-9e0f-b3623f03b707;ORQUIDEA PEROLA;Rua Palestina, 552 - Vila Mascote, São Paulo;-23.6443915;-46.6707038
013d78ef-6034-4e74-8b4c-670ceccce2e4;CASA DE CARNES C M ALMEIDA;Rua João da Cruz e Sousa, 414 - Jardim das Rosas (Zona Sul), São Paulo;-23.6584165;-46.78921
ed48b00e-8021-401b-a68e-c1f5d32a1db0;PAGANELLA PIZZARIA;Avenida Paula Ferreira, 2734 - Pirituba, São Paulo;-23.489177;-46.7180778
04a482da-40de-4280-bae8-d42b2981dcf2;AUTO POSTO S GERMAIN-SHELL;Avenida dos Autonomistas, 3840 - Centro, Osasco;-23.5301609;-46.7867854
39567d1c-c6c5-4a7c-b8a1-f2959ebb9227;PANIF PORTAL D PADEIRO;Rua Professor José Horácio Meirelles Teixeira, 546 - Vila Suzana, São Paulo;-23.6113382;-46.7340612
e1593345-fc4f-40ac-baff-5d2b63752117;SUEHIRO ROTISSERRIE;Avenida Gabriela Mistral, 160, BOX 8 - Penha de França, São Paulo;-23.5185892;-46.5474756
91fdf10e-d328-41c4-bd9c-bb373c7a6ef1;GIULIA PAES E DOCES;Avenida dos Autonomistas, 7210 - km 18, Osasco;-23.52394;-46.815163
ebcb8251-5d38-4505-973e-897fac590ab0;DOCERIA RIO BRANCO;Avenida Rio Branco, 237 - Campos Elíseos, São Paulo;-23.5408404;-46.639432
73dab2e9-e23a-49d1-b0b6-7816e335c0d8;ARMAZEM VIDA NATURAL;Rua Floriza Klen Vasconcelos, 372, LOJA 03 - Bela Vista, Osasco;-23.5503806;-46.7848123
f3710ebb-deae-444d-83af-59397f04bfdf;CASA DE CARNES BOI DO JARDIM;Rua Conde de Ericeira, 1A - Jardim Santo André, São Paulo;-23.634823;-46.443858
d2e84db0-519a-4696-9307-233e875380ea;BOMBONIEREPEREIRINHA;Avenida O Trabuco Rádio Jornal, 314 - Vila Menck, Osasco;-23.4992186;-46.7668983
1e6d53af-c549-4e9b-a997-37838e391fac;RAFAEL GUSTAVO F.CHIARELLI;Avenida Novo Osasco, 562 - Bussocaba, Osasco;-23.5642117;-46.78676429999999
3f96dc37-12f6-4fab-9170-1cb06efa0c81;JET AUTO POSTO;Rua Jacinto José de Araújo, 23 - Parque São Jorge, São Paulo;-23.5326496;-46.5658332
22d69571-7b8b-49bb-8ec4-f1df2c4b2dfc;MINI MERCADO FAMILIAR;Rua Gê Alves de Medeiros, 34 - Santa Maria, Osasco;-23.5709961;-46.8105646
5ade0656-96d4-4723-8052-450f99d9ebe5;CASA NORDESTINA;Rua Ananias de Almeida, 276 - Quitaúna, Osasco;-23.5337306;-46.812526
0fed3370-8f77-4628-aab3-b9ae16a71568;SACOLAO MESA FARTA;Rua Nelson Vieira Lima, 32 - Metalúrgicos, Osasco;-23.5734391;-46.8087996
eb075247-33a8-4094-8f4e-ca3206092654;POSTO DE SERVICOS AUTOMOTIVOS E COM;Avenida das Nações Unidas, 214 - Bonfim, Osasco;-23.5235906;-46.7797251
de620f80-a788-4b9d-ac83-45f4f519849f;CASULO;Rua João Collino, 321 - Centro, Osasco;-23.5333412;-46.77860800000001
dd56204b-41f4-4174-9e12-d6272a5f6de9;HERBALIFE;Avenida Yara, 442 - Vila Yara, Osasco;-23.5483207;-46.7658735
66eaae0b-3789-4fa8-b9e8-cbea3ef55e9e;MINI MERCADO CAROMBE;Rua Rosalvo José da Silva, 23A - Jardim Carombé, São Paulo;-23.4581097;-46.7028453
50b7bc31-82f8-4c4d-98f2-fb2d40eb5534;CARNES VILELA;Rua Vilela, 33 - Tatuapé, São Paulo;-23.5348977;-46.5682292
833d24c6-0db7-4cf2-90e6-8326c8d223e8;CASULO;Rua João Collino, 321 - Centro, Osasco;-23.5333412;-46.77860800000001
85ce121a-277e-4ab1-a13a-5e2fd4f3bec9;DELICIAS GLAUCI;Rua Bela Cintra, 678 - Consolação, São Paulo;-23.5536984;-46.6589829
e5cfc993-92e1-473e-a636-d8d7822a7125;HOLLYWOOD;Avenida Sapopemba, 1090 - Vila Regente Feijó, São Paulo;-23.5649434;-46.5706095
ec75e479-87b4-4360-a66d-6c861aeba087;PANIFICAD JD ROCHDALE;Rua Águas da Prata, 267 - Rochdale, Osasco;-23.5129766;-46.7766589
ff7a3891-fde8-45a4-8373-f5f741e85cf6;CEU PAES E DOCES;Rua Joaquim Félix Ribeiro, 179 - Vila Yolanda, Osasco;-23.546689;-46.79139869999999
f1d5e16f-90bf-465d-92df-6136bcdfaca5;MERC SAO FELIPE;Avenida Benedito Alves Turíbio, 1950 - Padroeira, Osasco;-23.549643;-46.8187948
60ce215e-ded4-481c-9947-b8c4c02b41b5;NINADOCE;Praça da República, 138 - República, São Paulo;-23.5441389;-46.6423727
1546e5c7-798f-4321-82b9-87e1f653fc6f;J R L;Avenida João Ventura dos Santos, 1946 - Baronesa, Osasco;-23.4947007;-46.7973775
acdf017f-a7a7-4e0c-91a9-0bf888526ab0;PONTO DO CHURASQUINHO;Rua Guiratinga, 283 - Chácara Inglesa, São Paulo;-23.6053379;-46.628397
bd9c4d8d-4f63-4a85-a59a-4947c81c2670;DELA DELE CONFEITARIA;Avenida Dom Pedro I, 138 - Vila Osasco, Osasco;-23.5402597;-46.7829039
822dd1aa-26aa-47f4-b7cf-b044c3ccc48d;CASA DE CARNES SIMPATIA;Rua Conselheiro Moreira de Barros, 1383 - Lauzane Paulista, São Paulo;-23.4900602;-46.6357138
44f3f709-8da1-4c40-aea4-254c87917c3a;MARCIA ARAUJO LOPES NUNES 999061;Rua Doutor Carlos Ubaldino Bueno de Abreu, 142 - Portal D'Oeste, Osasco;-23.4921186;-46.8013136
413bd7cb-54e1-4bcb-9f57-793fde9585ab;SUPERMERCADO 4 IRMAOS;Avenida Flora, 1461 - Jaguaribe, Osasco;-23.5616099;-46.7901912
3a2ef4d2-f27a-4788-ac61-c9fd6792e712;ALIMENTOS MIEKO;Rua Tiradentes, 13 - Bandeiras, Osasco;-23.5560589;-46.812061
2b03766b-23ff-4375-bb3f-45c9d553393a;CENTRO A C CERTO;Avenida Manoel Domingos Pinto, 610 - Parque Anhangüera, São Paulo;-23.5093094;-46.73253039999999
cf745976-6237-4247-9e98-9672ae2d92e8;MAURICIO TADEU;Rua Deputado Emílio Carlos, 355, AP 163 TORRE A - Vila Campesina, Osasco;-23.541582;-46.769372
46db1d74-d394-4afa-9cf8-101a15025c28;RESTAURANTE PERFIL;Rua Apucarana, 1134 - Tatuapé, São Paulo;-23.5480901;-46.5631704
0958f265-cd29-4762-9bf2-b1bc0f8caefc;BAR E MERCEARIA BOAVENTURA;Rua Boaventura Valério de Miranda, 11 - Bussocaba, Osasco;-23.5634424;-46.78436629999999
ad99066c-bd5b-444d-8218-a31b0a102fee;QUALITY BOI;Avenida Flora, 1032 - Bussocaba, Osasco;-23.5579814;-46.7890849
374b04e5-ad60-4ed2-af60-d10ccab89f8c;@ DO BOI;Avenida Ragueb Chohfi, 2914 - Parque Boa Esperança, São Paulo;-23.5824744;-46.4149287
42655f3d-1225-47f4-bd2b-b32891e7ca49;BRUH DOCES;Rua Alfredo Sturlini, 416 - Centro, Osasco;-23.5464996;-46.7751625
05ee6dea-8f7a-4752-9f90-ba5b4e13e135;CASA DE CARNES KI PREC;Avenida Inconfidência Mineira, 922 - Vila Rica, São Paulo;-23.5775164;-46.51659
5deaa526-6d0a-43ec-b24c-1ae6782f7d3c;L. H. TSUCHIDA DOCERIA - ME;Rua Aurora Soares Barbosa, 533 - Vila Campesina, Osasco;-23.5442252;-46.7718661
54c31a2c-fb58-4fb6-af80-fe0c6b2af433;ELTON GOMES VEIGAS SAL;Avenida Marechal João Batista Mascarenhas Moraes, 1596 - São Pedro, Osasco;-23.5414999;-46.811465
871457fb-0aeb-4f80-be28-fd1b9d7a61ff;BOI SOBERANO DE MINAS;Rua Itinguçu, 771 - Vila Ré, São Paulo;-23.5243098;-46.5073873
bfcef4df-ab51-4e4c-971f-8ee99ef4a5bb;SUPERMADO DO BAIRRO;Rua Agrimensor Sugaya, 470, (ZONA LESTE) COLONIA - Colônia (Zona Leste), São Paulo;-23.5583834;-46.4411657
4ab8d968-3417-47ce-90f4-7a1968e18969;IGREJA VERDE;Avenida Nossa Senhora do Sabará, 3260 - Vila Emir, São Paulo;-23.682367;-46.682418
90b3ccdf-cfaf-4114-8c0e-940c30829f1b;CASA DE CARNES PRESID;Rua dos Radialistas, 10 - Parque São Domingos, São Paulo;-23.5079381;-46.7329282
0251cd3b-ca6c-45ba-9264-7785868d7083;CASA DE CARNES CALCADA;Avenida Engenheiro Armando de Arruda Pereira, 3248 - Vila do Encontro, São Paulo;-23.6538999;-46.6373813
ad069869-76ee-45aa-a67a-4e5559c9729c;CASSANGE;Rua Moacir Salles D'Ávila, 747 - Vila Menck, Osasco;-23.501929;-46.7633014
360acde6-06c3-493c-b1db-9269255f6251;PAULISTA PAES & DOCES;Rua João Crudo, 46 - Centro, Osasco;-23.532724;-46.7794628
8086ba0c-da1e-455a-8a5b-f1a7fa23df8b;AUTO POSTO GLAUSSEA;Rua Tamuatá, 20S - São João Clímaco, São Paulo;-23.6208038;-46.592184
ebd3eef6-f7ff-49a0-a42a-2fb323767cf8;MARIA ANTONIETA;Rua Laura Sfasciotti Bernardi, 55 - Santa Maria, Osasco;-23.5706177;-46.8087785
9a87f48a-cbe8-4855-9ff3-e370f3984170;JOSE CARLOS EULALIO;Rua Doutor Mário Milani, 17 - Vila Campesina, Osasco;-23.5463208;-46.76615
d474f01f-eeff-43e2-b7e6-8e4813363dc6;ACOUGUE BR DE AQUIRAS;Praça Barão de Aquirás, 37 - Vila Canero, São Paulo;-23.5654966;-46.5734534
607b45dc-e5b1-431c-8bf0-730c959f64ab;DAN GIL PIZZARIA;Rua Vicente Túlio Romano, 23 - Jardim D'Abril, Osasco;-23.5680956;-46.7813249
b03bb982-731e-4b52-b536-bc5a3e75392d;COFRILAV;Rua Armênia, 882 - Presidente Altino, Osasco;-23.5291967;-46.7636405
1acd2fb8-cd79-475c-9a1a-c6b75be0315a;PADARIA CAROL;Rua Dorival Seabra, 588, LOJA 3 - Baronesa, Osasco;-23.4954566;-46.7880657
e8447394-1acb-4476-8e63-9c27b4aeb717;PONTO QUENTE PAES E DOCES;Avenida Água Fria, 1520 - Água Fria, São Paulo;-23.4758666;-46.6193863
d2599f61-bb00-40ce-aa12-0b1766f9cbff;CENTER CARNES BOIZAO;Avenida Paranaguá, 1012 - Ermelino Matarazzo, São Paulo;-23.4971654;-46.4777499
6963bfed-86ea-4171-847d-689b1961d5a0;DUNAS COM GENEROS ALIMENTICIOS;Rua Silva Bueno, 2533, LOJA 7 - Ipiranga, São Paulo;-23.6013249;-46.6004124
0188f924-d6dc-427d-a35c-5bd670bdd6ad;VANDERLEIA R O;Avenida Santiago Rodilha, 843 - Veloso, Osasco;-23.5609288;-46.8057643
e18233d1-cd8b-4d8b-9e41-c2d5a0a79949;LA BELLA;Avenida Crisântemo, 167 - Jardim das Flores, Osasco;-23.5334815;-46.79364289999999
16a375c3-6d47-4c47-9c0e-5056bfbe0b96;ELIZIO ANTONIO DA SILVA   ME;Rua Constelação do Caranguejo, 640 - Jardim Campinas, São Paulo;-23.768343;-46.705676
d87982be-231f-4e8c-9d33-27d93a349b8f;NADIR PEREIRA DA SILVA;Rua Joaquim Félix Ribeiro, 364 - Vila Yolanda, Osasco;-23.5467275;-46.7929324
b708758c-05e5-4cea-b872-3478fc95641a;PIZZARIA RICA PANCITA;Avenida Salvador Sindona, 246 - Jaguaribe, Osasco;-23.5599905;-46.7845627
dc79dfcb-9d26-4bf4-99c6-347317c71a0b;CONFEITARIA REBOUCAS;Rua César Eurico Serafino, 87 - Cipava, Osasco;-23.5516426;-46.7910417
1753f9dd-51ee-4264-ac2a-df027ae9ffd2;M LIMA;Avenida Novo Osasco, 1069 - Bussocaba, Osasco;-23.5677722;-46.7894644
d1349d22-6887-40f1-8d15-91fd98818fe5;POSTO AVANCO;Avenida Doutor Martin Luther King, 461 - Umuarama, Osasco;-23.5515552;-46.771838
ed91ef80-cfc5-4bd8-9e77-307f9f4e1152;PANIFICADORA SOL;Alameda dos Guainumbis, 50 - Planalto Paulista, São Paulo;-23.6120492;-46.6453984
0e4bb463-5ec5-48df-9835-fe4e8659dd7b;SUPERMERCADO SUPERETE;Praça Professor Eduardo da Costa Manso, 3438 - Jardim Clímax, São Paulo;-23.640178;-46.6074953
19c0f32b-2399-46ba-b36f-09e52043713e;MERCADO LUCIDANTAS;Rua Francisco José Viana, 564 - Cidade Tiradentes, São Paulo;-23.6080502;-46.4001592
c69f6e5f-fc3a-4295-a235-b323b233b5ae;SUELEN DA SILVA ANSELMO 32818255;Avenida João de Andrade, 1821, BOX 02 - Santo Antônio, Osasco;-23.5618746;-46.7985975
ef5a837c-4a6c-4d2b-a1de-123cd26ed369;FAZENDA DOS PAES;Rua dos Três Irmãos, 579 - Vila Progredior, São Paulo;-23.5894198;-46.7156515
6fbad03e-1fc8-4199-81b5-70b85ecdfab5;ANELMARA NOVAES DOS S;Rua Rocha Pombo, 127 - Jardim Elvira, Osasco;-23.5047671;-46.7969693
6b3983d0-5172-4212-8bfe-e1768113549a;BAR E MERCEARIA SERVE;Rua Alto Beni, 131 - Vila Cosmopolita, São Paulo;-23.559719;-46.42482200000001
76800649-f62e-47fa-955b-ac3a12bc00fb;DI CUNTO-MOOCA;Rua Borges de Figueiredo, 61 - Mooca, São Paulo;-23.5553495;-46.6074774
1b8a0177-1e79-4ca5-98d0-d67bae1b295a;CASAS DE CARNES MAYARA;Avenida Benedito Alves Turíbio, 1827 - Padroeira, Osasco;-23.5501488;-46.8176133
c425a427-0cde-4f94-9120-8bb5cd6f0501;PAES E DOCES M M;Avenida Valter Boveri, 42 - Bussocaba, Osasco;-23.5685714;-46.79108799999999
75999b73-135a-4f8e-a6ba-3e631e31e28d;CRISTALLO;Rua Oscar Freire, 914 - Cerqueira César, São Paulo;-23.5629093;-46.6690873
3c095425-c383-4b46-9c32-8bbcf02c92fa;JOSENI CARLOS GAMA;Rua Padre Vieira, 225 - Piratininga, Osasco;-23.5157782;-46.8003702
710d89c2-d4a8-416b-8c8c-56afa91a56d9;MIRACATU AUTO POSTO;Rua Matias Aires, 341 - Consolação, São Paulo;-23.5542601;-46.6591371
e0d5fc4a-5033-439d-b212-73e28354bd89;AUTO POSTO BAURU;Rua Cayowaá, 45 - Perdizes, São Paulo;-23.5299778;-46.6778671
c1a5ed2d-0db3-4036-9653-b8ec8108cc64;MERCADAO DE CARNES;Avenida Cruzeiro do Sul, 1117 - Rochdale, Osasco;-23.511217;-46.7781723
0e68e59e-b4f0-4da2-a1ed-d5b3bf95cbb6;DANTE;Rua Dante Battiston, 183 - Centro, Osasco;-23.5328286;-46.7772251
d198dddf-4c8d-4efd-b3f4-43eb5535480b;DEGUSTI;Rua Eloy Cândido Lopes, 26 - Centro, Osasco;-23.5336114;-46.7748886
7aad7f4a-b570-462c-a3d0-55911ccbc448;MERCADINHO COMPRE AKY;Rua Estrelas da Coroa Boreal, 31 - Jardim Campinas, São Paulo;-23.7715031;-46.7070584
9cbed607-ef0b-4b90-8f06-aab22ca21963;COMERCIO DE CARNES NOVA GUSMAO;Rua Cumai, 17 - Vila Esperança, São Paulo;-23.5298312;-46.5275349
5d0cb308-e873-4e9c-991f-a051098be7ef;4 SOUZAS;Rua Beija-flor, 54, (ZONA SUL) COLONIA - Colônia (Zona Sul), São Paulo;-23.8630678;-46.7127845
8f9c2c01-0fb2-48dc-b664-4a78d738531f;VAREJAO FAZENDA VERDE;Avenida Cruzeiro do Sul, 971 - Rochdale, Osasco;-23.512515;-46.778712
1714fd30-3a44-4d6e-a92a-154ceae11c33;CHOCOLICIA;Rua Dona Primitiva Vianco, 241 - Centro, Osasco;-23.5303309;-46.7754777
276e9813-dcbc-439a-9e4d-5aba2df31eaf;SALGOLANDIA DOCES E SA;Avenida Barão de Alagoas, 326 - Itaim Paulista, São Paulo;-23.4984088;-46.3965474
8336790f-952d-491a-84cf-14be1153334f;SHOWCOLATE;Avenida dos Autonomistas, 1768, LOJA D7 - Vila Yara, Osasco;-23.5357892;-46.7711861
76864e00-339d-49a0-97ab-a864310a6dd3;CASA CARNES DAMAR;Avenida Tucuruvi, 699 - Tucuruvi, São Paulo;-23.4808457;-46.6050726
cb6ac8ed-1e98-4b11-aec1-7d709672fee6;UNIAO DE OSASCO;Avenida dos Autonomistas, 825 - Vila Yara, Osasco;-23.5446541;-46.7631528
82fb69cb-b907-4ba8-a656-bf878a67d145;MERC AV SEITI;Avenida Fagundes Filho, 772 - Vila Monte Alegre, São Paulo;-23.6268934;-46.6339927
204a2b09-5561-4f42-aaa9-f39509ed6797;CATARINO;Rua Benedita Dornellas Claro, 151 - Jardim Andaraí, São Paulo;-23.5193124;-46.5782372
852699b1-52da-4eb2-ac97-12406a19e160;HORTIFRUTTI DA VILA;Avenida Presidente Médici, 2500 - Vila Menck, Osasco;-23.5062723;-46.7670608
