65ba4686-643c-4f4e-9472-b5578bf96f0a;MINI MERCADO ANDRADE;Rua Doutor Nelson Madureira, 195 - Vila Nhocune, São Paulo;-23.544992;-46.5037035
eccd7765-cf4c-452c-85c1-bc8ba053e88b;SUPERMERCADO MARACANA;Rua General Nelson Braga Moreira, 6 - Vila Yolanda, Osasco;-23.5482731;-46.7923527
216d6569-d4e7-44ef-8513-bef050eb4c41;BAALBECK COZINHA ARABE;Alameda Lorena, 1330, LOJA 3 - Jardim Paulista, São Paulo;-23.5649617;-46.6644875
dfab682f-7b08-4698-bb7b-850e7a76c5de;CASA DE FRUTAS JAGUARIBE;Avenida Flora, 972 - Bussocaba, Osasco;-23.5575939;-46.788891
55c5c738-b350-4925-912b-f25c342490b5;JC CARNES;Avenida João Ventura dos Santos, 2980 - Baronesa, Osasco;-23.492699;-46.8066326
23e8e66e-af71-45f7-ad87-44b273786a1b;M.D DE ALMEIDA MINIMER;Rua Veneza, 11A - Veloso, Osasco;-23.5662523;-46.7974351
099d0d37-9501-4908-bade-7e29f52053eb;ELZABADE COMERCIO DE DOCES;Rua Doutor Bento Vidal, 48 - Novo Osasco, Osasco;-23.5704045;-46.793769
1ca55a97-ec60-4336-bdc2-933b96211cc4;RONIVALDO DOS SANTOS PIZZARIA -;Rua Professora Adelaide Escobar Bueno, 555 - Munhoz Júnior, Osasco;-23.4970376;-46.8060931
7e2d86dd-b757-4923-88d7-c2142901e5ab;PIZZARIA MORIAH;Rua Oswaldo Collino, 400 - Presidente Altino, Osasco;-23.5300799;-46.7648623
c5579d90-891c-4691-8a5c-bdb4ea21e92a;LINDAS CARNES;Rua Frei Caneca, 860 - Consolação, São Paulo;-23.5546929;-46.65531619999999
8387dd63-7354-479e-871a-25ba5fd137ae;MARIO PROETTI;Rua Alto Sucuriú, 172 - Jardim Peri, São Paulo;-23.457547;-46.6633198
f648aece-6cd6-4ab2-a8c2-0665275f0dfd;CASA CARNES PAULINHO;Rua Rosálio José da Conceição, 121 - Jardim Felicidade (Zona Oeste), São Paulo;-23.4967028;-46.7254085
81d53115-3209-4343-aef8-79131baa9af3;PADARIA E CONFEITARIA;Rua Afonso Braz, 281 - Vila Nova Conceição, São Paulo;-23.5960043;-46.6667053
6a54db1d-8a35-4739-b750-7deb4e85570e;MAURICIO T MAKIYAMAME;Avenida dos Autonomistas, 1400, QUIOSQUE 64 - Vila Yara, Osasco;-23.5387322;-46.7650662
6fcdb4e0-05ed-4c64-a911-298956e4f90e;SUPERMERCADO EMA;Avenida João Ventura dos Santos, 2177 - Baronesa, Osasco;-23.4948574;-46.799242
01736756-7ffb-458a-a943-79c7e62209e7;BANCA MINORU-IGUATEMI;Avenida Brigadeiro Faria Lima 2232, 2232, LOJA Y17 - Jardim Paulistano, São Paulo;-23.5765562;-46.6878809
481c70db-0c50-4373-a58c-bf5ebfad6b90;TIO PATINHAS LAVA RAPIDO;Rua Henry Ford, 660 - Presidente Altino, Osasco;-23.5266968;-46.7638938
de6ba49a-5d5b-4516-8e4e-4c437847856c;PADARIA BRASIL;Avenida do Oratório, 4685 - Jardim Guairaca, São Paulo;-23.6028385;-46.5295655
c2bff34d-b7f5-45de-8abd-af5f5e8940fa;CASA DE CARNES SZABO;Rua Rio Bonito, 1575 - Brás, São Paulo;-23.5299494;-46.61765640000001
c23cd5f6-2bdf-4b3f-bc0a-7c9097586501;JILDECI BATISTA BONFIM;Rua Itaperuna, 455A - Padroeira, Osasco;-23.5496335;-46.8092484
e8514983-771e-45a3-a112-04da473a456b;CENTER CARNES CAPRICHO;Rua Bolivar Ribeiro Boaventura, 168 - Jardim Penha, São Paulo;-23.5083052;-46.4999981
94cc5408-da5e-4605-a83b-f96ecbcc80fc;DI SIENA COMERCIO CHOCOLATES;Rua João Ramalho, 1050 - Perdizes, São Paulo;-23.5340778;-46.6755877
f82544a6-1bc7-4efc-a0af-afc574c4558b;DAKI PAES E DOCES;Rua Jaspe, 56 - Mutinga, Osasco;-23.5095452;-46.772688
f04c0fed-10f1-40e6-a799-591ff0823f7e;MERCADINHO BEZERRA;Rua Clara Nunes, 540 - Baronesa, Osasco;-23.4956797;-46.7874926
731a0d5a-7bd5-4d93-b0ee-6029f62b0a29;MERCADO FILIPINI;Avenida Doutor Martin Luther King, 316 - Umuarama, Osasco;-23.557554;-46.7623164
0546bbcd-d1fd-47fd-ad50-75b5c189d7f5;ACOUGUE VOLTA PRA MIM;Rua Doutor Campos Moura, 210 - Parque Artur Alvim, São Paulo;-23.5412595;-46.4848022
dd3b0f58-78ff-4852-b4a7-aff0738681b8;PANIFICADORA JOIA;Avenida Nossa Senhora dos Remédios, 216 - Remédios, Osasco;-23.5197553;-46.7552576
9c7f0a93-b11b-4bae-8599-4cd70eb6f562;CENTER CARNES ESTRELA;Avenida Brasil, 2000 - Rochdale, Osasco;-23.512545;-46.78200810000001
87de5d69-2a73-411e-b041-31fc4837188a;CASA DE CARNES FABOSSE;Avenida Hildebrando de Lima, 752 - km 18, Osasco;-23.5313405;-46.7982013
7b5fa7d9-abe2-40ee-9355-a75175ec3ce8;PADARIA E CONFEITARIA PAOLA;Avenida Internacional, 304 - Santo Antônio, Osasco;-23.5550601;-46.7967475
a1532aa6-ce6d-43ea-ae57-7ebbbe1126dd;MARILENE DE OLIVEIRA;Rua Juriti, 134 - Aliança, Osasco;-23.5132304;-46.7844935
d875458f-80ab-4015-a088-7e72a51d9cf6;PADARIA SIBELE;Avenida Maria dos Anjos da Conceição, 177 - Jardim Roberto, Osasco;-23.5493569;-46.80547259999999
fd1b0c7b-bad6-4104-a6ea-53309ea0e98b;TOQUE DE ARTE;Avenida dos Metalúrgicos, 1033, LOJA 1 - Cidade Tiradentes, São Paulo;-23.5914971;-46.407269
4af80035-16a1-4e21-a6a0-81ac0edd236c;LOJA ADR;Praça Avelino Francisco de Lima, 355 - Novo Osasco, Osasco;-23.5702817;-46.7931866
70ca0fef-0974-4b49-bae4-1a224c5d8bcd;BIG PAES E MERCEARIA;Rua Belém, 218 - Rochdale, Osasco;-23.5058301;-46.7791952
f3efe25c-7969-4b8a-b22e-c0249913fdf8;PAES E DOCES GATO DE O;Rua Doutor Luiz Migliano, 988 - Jardim Caboré, São Paulo;-23.6132477;-46.7428813
c208dfd0-e0db-4677-aca6-87962dd09209;ATACADAO DA CARNE;Rua Antônio Leite Penteado, 602 - Jardim Verônia, São Paulo;-23.4897798;-46.4890496
0f12e6c7-0ece-4455-8098-2cc5543774b9;CASA DE CARNES MESSIAS;Rua Joaquim Gutier Navarro Filho, 98 - Bonança, Osasco;-23.4898962;-46.7900492
945bde1e-5d74-4f31-973a-ba6791f071ff;LA VERTE;Avenida Nova Cantareira, 320 - Tucuruvi, São Paulo;-23.4877003;-46.62134589999999
94f73842-f7cd-45b5-ac78-0965e37649e6;ARCO IRIS;Avenida Benedito Alves Turíbio, 221 - Padroeira, Osasco;-23.5585025;-46.8060464
285453bf-6b80-4843-837a-4d0a4208ca60;CASA CARNES PORTO BELO;Rua José Filipe da Silva, 399, TERREO - Jardim Ester, São Paulo;-23.5826075;-46.7609631
aafddeee-f6a0-4723-8fca-24d97f28cdf9;CASA DE DOCES GRITT;Rua Artur Alves de Senna, 34 - Vila Yara, Osasco;-23.5482499;-46.7639297
26244d84-616b-4f7b-87e9-04ed6ecbd20d;PADARIA E CONF SINES;Avenida Nossa Senhora do Sabará, 1785 - Vila Santana, São Paulo;-23.6700552;-46.6883799
2fda417e-e3ac-4983-804d-a6977b866794;MERCADINHO FREITAS;Rua Agatino de Esparta, 321 - Chácara da Enseada, São Paulo;-23.7498537;-46.7815799
3b361e1b-58ea-4555-aece-7ee3515a256f;DOCERIA FANI;Avenida General Ataliba Leonel, 2616 - Carandiru, São Paulo;-23.4931245;-46.6092863
7bb8e1df-1ba5-46bb-8981-731ac94c5327;LA FLORESTA;Avenida Guapira, 1984 - Tucuruvi, São Paulo;-23.471787;-46.587157
cb44a6b5-f84d-47dc-8ae1-54578ca28931;PANIFICADORA ARCADAS;Avenida Brigadeiro Luís Antônio, 2098 - Bela Vista, São Paulo;-23.5662385;-46.648377
0961ea10-0714-44a3-a445-a9076ff7ad45;PANIF AIROSA;Rua José Anacleto da Silva, 3 - Ayrosa, Osasco;-23.5156414;-46.7667341
1e14e5c8-4520-4d63-a80e-6deeceae1437;SATALE SUPERMERCADO;Avenida Benedito Alves Turíbio, 321 - Padroeira, Osasco;-23.5584554;-46.8074529
a35fa7f2-efaf-43d6-bf6c-b152c26d17c7;RAINHA DO PIRATININGA;Rua Amador Bueno, 1142 - Piratininga, Osasco;-23.5165781;-46.7988442
6921e11a-8be2-40f3-9d78-bd7883ca33c6;CASA CARNES REI IMPERADOR;Avenida Luís Pires de Minas, 735 - Cidade Centenário, São Paulo;-23.5881323;-46.5005079
fd47d602-1e02-42f7-a520-efbc7250419d;LEILA SILVA ROSA;Rua Olívio Basílio Marçal, 144 - São Pedro, Osasco;-23.5411697;-46.8127354
a648188d-2249-45c6-aeb7-c5bac9e12a15;MERCANORTE;Avenida Coronel Sezefredo Fagundes, 1562 - Tucuruvi, São Paulo;-23.465628;-46.60351
d82cc33a-eabd-4172-879d-d666143857fd;CLAUDIA PATRICIA DE CA;Rua Juan Vicente, 242, CASA 02 - Bandeiras, Osasco;-23.557045;-46.8125254
e8e85563-1575-460c-9a6b-c91a0804db33;CENTER CARNES BOIZAO;Avenida Diogo da Costa Tavares, 52A - Jardim Margarida, São Paulo;-23.4842052;-46.3847736
597a5882-43b6-41f5-aa6b-1156595e0781;CMM;Rua Piacatu, 317 - Munhoz Júnior, Osasco;-23.504285;-46.8063943
014b457c-cd8a-43fd-b14d-f2afc0bfee34;VAGNER;Rua Pelicano, 90 - Aliança, Osasco;-23.5065035;-46.7844312
54effeff-b0b3-4f18-ad1f-ce63172420e6;MIYUKI ROTISSERIE;Rua Hipócrates, 139 - Jardim da Saúde, São Paulo;-23.6185079;-46.618193
c386605c-3c97-4669-8ada-1c190a613b4a;BRASILEIRA PAES E DOCE;Rua das Palmeiras, 2 - Veloso, Osasco;-23.5658673;-46.8038124
3f31b950-d577-4bc2-b8b8-8a7a161154e2;IRACEMA DO BROOKLIN;Rua Nova York, 773 - Brooklin Paulista, São Paulo;-23.6117812;-46.6816377
7f0ceaf8-65bf-41fe-a529-1981228d8855;SUPERMERCADO O MELHOR;Rua Anhaia, 748 - Bom Retiro, São Paulo;-23.523834;-46.64524
1b069fda-631f-4f61-941b-72f15504dfb8;ORQUIDEA PALACE;Rua Conselheiro Furtado, 1187 - Liberdade, São Paulo;-23.5635982;-46.6323547
13f76217-6848-4edd-b0f5-6b2c902192a6;MERCADO E PADARAIA LUANA;Rua José Fugulin, 48 - Jardim Santa Cruz (Campo Grande), São Paulo;-23.6848351;-46.6753601
bfd7bdfc-4f52-4841-b521-81151bf0c0b6;BIG PAO EXPRESS;Avenida Líder, 1761 - Cidade Líder, São Paulo;-23.5560172;-46.4777925
6adad217-076d-41b4-af5d-47a00c618e2f;NOVA AJURICABA;Avenida dos Remédios, 1005 - Remédios, Osasco;-23.5167008;-46.7547825
9001b2b6-cee1-4496-8818-123b88366f83;CENTER AMIGOS;Rua Clotilde Galesi, 30 - Vila Osasco, Osasco;-23.5444182;-46.7767354
80103ee1-bf01-40e3-ac51-15ec484a3962;BARRIGAS BAR;Avenida General Pedro Pinho, 73 - Pestana, Osasco;-23.5312269;-46.80191600000001
dbc9a844-f9bc-41f6-b7cc-7629dae86443;ELITE PAES E DOCES;Rua Duclerc Rovai, 356, LOJA A - Santo Antônio, Osasco;-23.5562583;-46.7957448
92adda9f-68fa-44fe-a3fb-6cbd1aa9f640;TOULON EMPORIO;Rua Herbart 47, 47, BOX 102 - Lapa, São Paulo;-23.5193882;-46.7018484
49874aa9-43c6-4bc5-a693-c819776d05b3;MERCADO BOM PRECO;Rua Julieta Esteves Alexandrini, 256 - Helena Maria, Osasco;-23.4963274;-46.7965552
f7ba1b79-cd48-4f44-9ae0-a1cadc91d785;BANDEIRANTES VI;Rua Professor Guilherme Belfort Sabino, 903 - Campininha, São Paulo;-23.670438;-46.6813173
40d010e5-5380-498e-99e9-d9a766c5c3db;ALDIANA DOS ANJOS FERREIRA CRUZ;Rua São Judas Tadeu, 61 - Bonança, Osasco;-23.4883643;-46.7893733
4a9a7dbc-1fc7-407b-8cf2-33534977bedd;KELLE CARNES;Rua Antônio Pinto Vieira, 94 - Vila Espanhola, São Paulo;-23.4840432;-46.66403469999999
c0f1376b-6857-43ee-aa59-75bbe77f6414;ACOUGUE DO CHICAO;Avenida Nossa Senhora do Loreto, 487 - Vila Medeiros, São Paulo;-23.4904324;-46.5860131
bd04e6e1-8fad-40a8-94f5-7b69c89d7545;MS BOLO;Rua Doutor Carlos Morais de Barros, 19 - Vila Campesina, Osasco;-23.5416441;-46.7721706
50415bf2-27a4-4ea9-81fa-9165b7b9027b;PAES E DOCES MIRANTE;Rua Guajurus, 31 - Jardim São Paulo(Zona Norte), São Paulo;-23.4965799;-46.61566209999999
ec37f677-1f2c-4888-9746-649a71e5cd35;CENTER CARNES CHEGA MAIS;Rua Tamaindê, 817 - Vila Nova Manchester, São Paulo;-23.5440204;-46.5346746
ffe6e5e8-a787-4d33-8347-a1afa96a896d;NUTRI LEAL;Rua Martim Afonso, 214 - Piratininga, Osasco;-23.5199057;-46.7936474
08a6a4be-4848-473b-8716-8776ca701f65;RESTAURANTE E PIZZARIA ABADE;Avenida Getúlio Vargas, 983 - Piratininga, Osasco;-23.5087969;-46.7886974
416f9fc9-624a-4d71-a4bc-4f34433dad03;EMPORIO FAMILIA GORDOLA;Avenida Flora, 998 - Bussocaba, Osasco;-23.5577659;-46.7888981
da4c7890-5bf8-4ded-9d41-289854e92f83;MSMS COM DE ALIMENTOS EIRELLI;Avenida dos Autonomistas, 1768, LOJA H3 - Vila Yara, Osasco;-23.5357892;-46.7711861
df2987a5-cdce-4c06-8281-b59b8c63fd52;PADARIA CONQUISTA;Rua Georgina, 185 - Jardim das Flores, Osasco;-23.5393173;-46.7903771
19c21ab9-c72b-4373-88a1-c730cd437f62;PAES E DOCES DO DIA;Avenida Maestro Alfredo Belardi, 126 - Padroeira, Osasco;-23.5566154;-46.80448579999999
03806afa-fdcf-40b9-ae4d-ac14d67934f0;AUTO POSTO ALCANTARA-SHELL;Avenida Atlântica, 3771, LOJA 9 - Interlagos, São Paulo;-23.6957644;-46.71455659999999
048abe66-0adc-4760-b26e-68f393bbd30b;MERCADINHO RODRIGO LEA;Rua Cisne Negro, 64 - Jardim Shangrilá (Zona Norte), São Paulo;-23.4286541;-46.7277242
3effc194-ffbd-405e-88de-746044c68962;AMSTERDAM-DOCERIA;Rua Gonçalves Crespo, ???, LOJA 401 - Tatuapé, São Paulo;-23.538538;-46.5755367
5b3ce890-7084-402e-92da-b694f84c1f97;POSTO BOLA PESADA-SHELL;Avenida Moreira Guimarães, 700 - Indianópolis, São Paulo;-23.6117008;-46.6568616
a6afd604-cbf3-406c-8dc3-f04b4ee8f765;AVICOLA COCAIA;Avenida Dona Belmira Marin, 3671 - Parque Brasil, São Paulo;-23.7544537;-46.6794939
eaf15d86-e071-4de8-a8c5-2baf5087b0ac;MERCADO DO LOURO;Rua Vermelho, 11 - Bonança, Osasco;-23.4909141;-46.7881271
9fb610a3-50ee-4580-80ce-d25c90b8bd33;APARECIDA R.L.DE OLIVEIRA;Avenida das Esmeraldas, 553 - Mutinga, Osasco;-23.5059849;-46.7701826
385bd274-ce35-4727-ac70-a39830203297;MINE MERCADO CALL 2;Rua Florêncio da Silva, 118 - Vila Libanesa, São Paulo;-23.509137;-46.5070843
f0bea26a-e7b6-469b-89a8-6e843dfdc8d6;CASA DE CARNES BOI BRA;Rua Helena Maria Ferreira Munhoz, 450 - Helena Maria, Osasco;-23.4959941;-46.8030384
204febd4-2d62-4d71-9a37-a37d3d82f31e;SOL NATURAL;Avenida João Batista, 334 - Centro, Osasco;-23.52836;-46.779806
d3abdc6f-b013-4e21-8f99-e5520303bcaa;BARRACA DO SILVIO;Rua João Tomás da Silveira, 518 - Helena Maria, Osasco;-23.4936505;-46.8050935
abaa98a3-e620-4a39-a22c-e25ab4f5dd80;SUPER 10;Rua Ângelo Alberto Nesti, 83 - Bussocaba, Osasco;-23.5657317;-46.79215139999999
f5066057-df9c-49ab-9855-6ca90870cced;CONV E PAD STO ANTONIO;Avenida Jaguaribe, 351 - Jaguaribe, Osasco;-23.557583;-46.784818
82e933e3-fef3-47a6-b39a-3ffa9d963ef3;ESTACAO DOCES;Rua da Estação, 29 - Centro, Osasco;-23.527563;-46.7767239
c28b1ca5-9b09-4cfb-9bfd-e5b29cbee391;CICERO DE ASSIS DA SILVA   FRUTA;Rua Arthur Friedenreich, 377 - Ayrosa, Osasco;-23.5140934;-46.75942089999999
69ed5bd4-2ecf-412f-89e1-ddf525bdde0c;AMOR AOS PEDACOS;Rua Cardoso de Almeida, 1021, LOJA 4 - Perdizes, São Paulo;-23.5396341;-46.6692925
47cf1fe1-ef0d-4e5d-a2b5-25dc4fe13362;EMPORIO SANTA CRUZ;Estrada Lázaro Amâncio de Barros, 509 - Vila Itaberaba, São Paulo;-23.4649243;-46.6952499
abf8df67-2e2c-48c1-bc5c-98f6b4a43179;A GALETERIA ASSADOS;Avenida Cotovia, 357 - Indianópolis, São Paulo;-23.605937;-46.672189
ac160ad8-df4f-499b-a00b-a12748946b90;PEG SKENT CONGELADOS;Rua Ramos Batista, 350 - Vila Olímpia, São Paulo;-23.5937875;-46.6839839
838767fa-439c-4ba6-ba5c-70ac5dce266c;PAES E DOCES JD EUROPA;Rua Doutor Mário Ferraz, 43 - Jardim Europa, São Paulo;-23.5811025;-46.6874263
979612bd-5234-49b8-8d5e-c3bf09b5473b;GRANJA E ACOUGUE MARA;Rua Antônio Russo, 201 - Jardim Roberto, Osasco;-23.5507427;-46.80185549999999
29d64086-f8f3-4edf-98a3-c31c43479486;MINIMERCADO FAVORITO;Avenida Osvaldo Costa, 484 - Vila Menck, Osasco;-23.5045753;-46.7665905
06a869cf-8560-4afa-a978-3eb18a7d2e6c;FAFE PAES E DOCES;Rua Onze de Fevereiro, 23 - Cidade Vargas, São Paulo;-23.6452661;-46.6392908
5ea61ffb-d358-4b0c-8fcd-f85e6e48b905;AVICOLA FLOR DA VILA M;Rua Paracuru, 4 - Vila Minerva, São Paulo;-23.539375;-46.4140467
8dac090d-a18d-45a2-9d12-9636aaf4f20d;AGITA SORVETES;Rua Presidente Costa e Silva, 945 - Helena Maria, Osasco;-23.5000203;-46.7962886
89180c14-d088-4e31-bb4e-492f7ba78ac9;MERCADO DO TADEU;Rua dos Maratis, 44 - Vila Guacuri, São Paulo;-23.6986675;-46.631578
9c1df974-ef14-43fa-a240-a16bdb631ab4;KAKAOBOHNE;Rua Caitezal, 316 - Água Fria, São Paulo;-23.4821216;-46.6210856
7971b25b-26e1-4855-b05e-d9773a1588f7;CASA DE CARNES VITAL;Rua Rubens Fraga de Toledo Arruda, 157 - Engenheiro Goulart, São Paulo;-23.5020776;-46.5148758
f605c216-064c-432b-b4c4-1bded8edd9cb;LA BUONAPASTA;Avenida Santo Antônio, 2504 - Vila Osasco, Osasco;-23.5442007;-46.7784893
c5f5b224-981e-4cba-b9d0-466be565fcac;PADARIA BIENAL;Rua Américo Alves Pereira Filho, 486 - Vila Morumbi, São Paulo;-23.6112267;-46.7050166
c935b735-5134-4b49-ac16-ddbb046e102e;SANTA CLARA;Rua Darwin, 435 - Jardim Santo Amaro, São Paulo;-23.6536102;-46.6981817
13255bfa-338c-45aa-b7f9-e0b32c6c10ef;SUPERMERCADO TUKA;Avenida Salvador Jorge Velho, 741 - Parque São Rafael, São Paulo;-23.6260449;-46.46579089999999
3106ab08-3c23-410d-b072-7e982e3ed302;DOCERIA INNOCENCIO;Avenida Deputado Emílio Carlos, 2075 - Limão, São Paulo;-23.4893456;-46.6755862
c560b217-22f0-4fc6-be62-2f03b0d1a3c4;MINI PAES E DOCES TONI;Praça Hiraku Yamato, 75 - Rochdale, Osasco;-23.5165259;-46.7759933
6bed1e1b-425b-474f-945e-c29302e9d96a;CENTER CARNES CLG;Rua São Teodoro, 761 - Vila Carmosina, São Paulo;-23.555069;-46.4534862
987191b5-a65b-4055-bb1b-d40e17b7d74b;POSTO ESTRELA DO LESTE;Rua Galileu Menon, 95 - Artur Alvim, São Paulo;-23.5378948;-46.4896507
cc910254-fe04-4a28-8cea-34371916a461;CASA CARNE N ESPERANCA;Rua Campina Grande, 383 - Rochdale, Osasco;-23.5142426;-46.7804891
68de8918-f964-4532-8b88-ee73bca17fbe;POSTO SAO DONATO-SHELL;Rua Anhaia, 1092 - Bom Retiro, São Paulo;-23.5210429;-46.6466237
2b397a11-65f1-4ad3-a032-c13a68d27b2b;AVEIRO;Avenida Santa Catarina, 563 - Vila Alexandria, São Paulo;-23.640781;-46.6672711
4005b7b5-5c84-4da0-b1fd-f52086b5d7d0;DVILLA PADARIA E CONVENIENCIA;Rua Joaquim Lapas Veiga, 46 - Jardim D'Abril, Osasco;-23.5631431;-46.7820335
db3306d2-7569-4ce9-8ff8-5fbfd2863091;CS DE CARNES TOUREENSE;Praça Doutor Sampaio Vidal, 144 - Vila Formosa, São Paulo;-23.5681865;-46.5408444
47706ee1-192b-4679-9e4a-b8fb0f3a2928;MERC SILVA AGUILAR;Estrada da Ponte Alta, 3 - Engenheiro Marsilac, São Paulo;-23.881301;-46.7414223
f8ebb949-d619-48f3-93a6-3c293f319f24;COM DE CARNES HELAINE;Rua Clélia, 742 - Água Branca, São Paulo;-23.5248862;-46.6896789
0a1ee1be-58bb-4737-acf5-3b26f8edbc96;JMJ CONVENIENCIA;Rua Trás os Montes, 14 - Santo Antônio, Osasco;-23.5537735;-46.7942866
679138fc-6062-401a-b9c6-3f61460e1633;MERCADO COSETTE;Rua das Ameixeiras, 413 - Conjunto Residencial Jardim Canaã, São Paulo;-23.6567254;-46.6642169
ced63e58-92b5-4b69-a19d-cde1f19cd782;MUNIK CHOCOLATES;Rua Caitezal, 1658 - Água Fria, São Paulo;-23.4833044;-46.6207567
4f8633d5-a181-45be-8cfb-e1554e401d1d;POLIANA PROD NATURAIS;Avenida João Ventura dos Santos, 932 - Helena Maria, Osasco;-23.4973442;-46.7903482
638fd9f4-bb9e-4632-bfba-39b255e58b6d;PAD.E CONF.FLUMINENSE;Rua Almeida Torres, 331 - Aclimação, São Paulo;-23.5690399;-46.6268683
678097d0-16df-419d-998a-e6dcc26ab591;J. C. CARVALHO CONVENIENCIAS;Rua Benedito Egídio Barbosa, 188 - Brasilândia, São Paulo;-23.4598513;-46.69954569999999
74da7aad-fcec-4ff7-984a-d81f84ba4e65;ASTURIAS;Rua Tenente Avelar Pires de Azevedo, 367 - Centro, Osasco;-23.5313063;-46.7798645
b171feeb-d571-4ed6-9a43-41a7222309bf;COLMEIAS PAES E DOCES;Rua Antônio de Pádua Dias, 650 - Perus, São Paulo;-23.4012748;-46.7522673
cf2a9a9d-6404-4ef0-a7d6-a6709f2e9fdb;MERCADO BELMONTE;Rua Gilberto de Alcântara Paulino, 10 - Novo Osasco, Osasco;-23.5779016;-46.7914909
c087a45d-3f05-4780-a233-4efae6016a3a;BIFE LEGAL;Rua Enéas de Barros, 399 - Vila Santana, São Paulo;-23.5195665;-46.5340125
1b7cf279-6433-434a-adb6-3a66af2d655b;A PIONEIRA;Rua dos Macunis, 624 - Vila Madalena, São Paulo;-23.555766;-46.69954509999999
7f83b3e9-98ca-4116-964b-36be5fd72b7e;PANIFICADORA BIOPAO;Rua da Consolação, 863 - Consolação, São Paulo;-23.548308;-46.6495755
d1159fc7-ff09-4164-8328-7b2ebcffae5d;EULINDO;Avenida Pau Brasil, 392 - Cidade das Flores, Osasco;-23.535866;-46.8086025
f1424225-7828-46b5-bdd5-d038ff75bd13;EMPORIO CHICOS;Rua Sebastião Antonini, 10 - Helena Maria, Osasco;-23.5053356;-46.7987401
75f4e72e-787a-47c2-ba83-fc39519ef0c3;MERCADINHO LEMES;Rua Mateus Leme, 15 - Água Fria, São Paulo;-23.482952;-46.6295277
f16a7fa8-67d6-4745-aee0-c97b350906c9;AMOR AOS PEDACOS;Avenida Braz Leme, 2087 - Santana, São Paulo;-23.5038369;-46.6402521
38b8045d-d22a-4a88-8c79-0749e10b0a61;CASA DE CARNES ENCOSTA NORTE;Rua Padre Virgílio Campelo, 60 - Itaim Paulista, São Paulo;-23.5048625;-46.3780049
ee90bd91-f657-4fe1-9bb4-05b5091f30ba;PADARIA VIVA A NOITE;Rua Jequirituba, 1943 - Parque América, São Paulo;-23.7377633;-46.6873115
2ad48ae5-4660-46b7-b9bb-3acebc6ea5cc;IRMAOS CROCCE;Rua Maranhense, 457 - Conceição, Osasco;-23.5829529;-46.7993829
fcdfb7a1-eb48-4ec5-8e88-087d09823612;CENTER CARNES LETICIA;Rua Pietro Clissa, 250 - Bonança, Osasco;-23.4893235;-46.7892434
e7417679-4291-4e38-8dae-85b0d1ee61fd;CASA DE CARNES DAVILA;Rua Moacir Salles D'Ávila, 560 - Vila Menck, Osasco;-23.5015041;-46.765097
b7e704c6-75e4-437e-bbe4-8e6ff84466e5;PANIFICADORA VIPAO;Rua Ferreira de Araújo, 604 - Pinheiros, São Paulo;-23.5630959;-46.698168
b127af9d-95d3-49f0-9089-620c4eda7622;PANIFICADORA GUAPORE;Rua Eduardo Chaves, 214 - Luz, São Paulo;-23.523307;-46.628556
389bba1c-d3d7-40fc-b70d-b0dfd260a2ea;EMPORIO NATAN;Avenida César Abraão, 36 - Vila Osasco, Osasco;-23.5377638;-46.7871755
19df15ee-e78a-405c-8f1d-61898b7c3a90;JANAINA APARECIDA ROSSI GONCALVE;Rua Luciano Francisco da Silva, 10B - Novo Osasco, Osasco;-23.5759754;-46.794684
d5305fa4-2ee7-4c93-a8a5-4a90e7ec7a35;SUPERMERCADO RODRIGUES;Rua Professor Sud Menucci, 843 - Jardim Elvira, Osasco;-23.497009;-46.805296
3dd09b6c-b127-4613-bd66-bd4d551e23ce;TADEU MAURO JACOMETO ME;Avenida das Esmeraldas, 551 - Mutinga, Osasco;-23.5060138;-46.7700292
3822660e-2324-47f0-ae37-60910a7c176c;CASTELINHO PAES DOCES;Avenida Cruzeiro do Sul, 1797 - Rochdale, Osasco;-23.5050508;-46.7770981
269c3be7-08c7-49fd-ab32-306829eb33ef;MARINES ROTISSERIE;Rua Carneiro da Cunha, 215 - Vila da Saúde, São Paulo;-23.6151959;-46.6371826
d53839e0-d962-4c9f-8240-edc10910944b;COM DE CARNES SIGNO;Avenida Leôncio de Magalhães, 1210 - Jardim São Paulo(Zona Norte), São Paulo;-23.4908272;-46.6184854
4f65270b-4451-44f7-8d9a-736db556063a;PAO E DOCES IMPERIAL;Rua Narciso Sturlini, 344 - Centro, Osasco;-23.5420628;-46.7740381
528878c5-0878-4a27-a6ab-a0f726a5886b;TESTA BEBIDAS;Rua Airan, 12 - Jardim Roberto, Osasco;-23.5439467;-46.8101345
dd5e5796-2255-458d-a9dc-05ee0d806c55;MARCIA MOTA 07733841895;Rua Benedito Américo de Oliveira, 38, FUNDOS SALA 5 - Vila Yara, Osasco;-23.5476705;-46.7660868
0a9553ea-7151-45e8-bdc9-06162d3cc1b2;ARAUCARIAS BAR E LANCHONETE;Avenida Antônio Carlos Costa, 952 - Bela Vista, Osasco;-23.551016;-46.7854839
690f0326-6bce-4176-a58f-6c1da5c6687c;PANIFICADORA RAINHA SAO LUCAS;Avenida São Lucas, 222 - Parque São Lucas, São Paulo;-23.5949509;-46.54728
7ea75fc3-d3e0-4902-9b25-707b6413fbc4;AUTO POSTO PLAYGAS;Avenida Marquês de São Vicente, 999 - Várzea da Barra Funda, São Paulo;-23.5206909;-46.67068099999999
263dad7e-d65d-4c39-9e0e-ba59b7693652;MERCADINHO JUVENAL;Rua Laura Sfasciotti Bernardi, ??? - Santa Maria, Osasco;-23.5702367;-46.8098128
3ac7870c-49cb-4239-8fe4-6b4b8c3ba41b;BELO BOI DA MISSIONARIA;Avenida Yervant Kissajikian, 3666 - Vila Joaniza, São Paulo;-23.6849158;-46.6482932
f626bc44-df28-4b97-8264-7bd5c75cda8a;VIEIRA ACOUGUE;Rua do Outono, 425 - Vila Itaberaba, São Paulo;-23.4608483;-46.694953
66d33dc2-6ebb-4c6e-ba7e-5e82a9c4fd81;K LON DELICATESSEN;Rua Ananias de Almeida, 377 - Quitaúna, Osasco;-23.5339779;-46.8134019
e79c8cdb-5f63-472b-acc8-58db1b700770;GOMA CONVENIENCIAS;Rua Dom José de Barros, 315 - República, São Paulo;-23.5434206;-46.6395357
27349339-4832-4f70-9431-f81dbb74385d;MERCADO MJ;Rua Mário de Andrade, 79 - Vila Menck, Osasco;-23.5031656;-46.769585
b7f1d88a-5e0e-4e67-88f4-37314c8c6ea3;CASA DE CARNES CALCADA;Avenida Engenheiro Armando de Arruda Pereira, 3248 - Vila do Encontro, São Paulo;-23.6538999;-46.6373813
64ac2f1c-0944-4bda-9021-103deecad64f;CHOCOLATES LIVERPOOL;Avenida Doutor Vital Brasil, 438 - Butantã, São Paulo;-23.5710986;-46.70835839999999
286deae8-728f-4d80-8319-7ca389a3ad93;SHANGRI-LA;Rua Abatira, 25 - Vila Santa Catarina, São Paulo;-23.6451298;-46.6723516
8f8b2a06-9f6c-49b9-ac6c-c20ae9330094;CENTER CARNES FLORAO;Rua Urbano Duarte, 510 - Vila Baruel, São Paulo;-23.5062439;-46.6546879
26a0c016-f09c-4a56-91d6-c9162500f5b9;ALEX PEREIRA CONFEITARIA - EPP;Rua Joichi Yamaji, 238 - Metalúrgicos, Osasco;-23.5653336;-46.8150476
555bb3dd-38a0-4bb6-90c6-864417a61259;CADILLAC BURGUER;Rua Juventus, 296 - Parque da Mooca, São Paulo;-23.5700392;-46.5918788
89a03c71-4fe7-4d04-9df6-33eb0790a591;MESTRE CICERO ROTSERIE;Avenida Sargento Geraldo Sant'Ana, 558 - Jardim Taquaral, São Paulo;-23.6636241;-46.6855903
b6fd3bd5-fffc-467f-ac2b-3dffa71fb2d2;TANIA AP QUINI MERCEARIA ME;Rua Emiliano Manojo, 140J - Cipava, Osasco;-23.5472282;-46.7855169
8321fda0-725f-41d2-8f3e-b91c0911a251;CASA DE MASSAS MALANDRINO;Rua Capitão Macedo, 176 - Vila Clementino, São Paulo;-23.5931736;-46.6413063
67352873-e9f0-494e-9fa9-310ad0b91ac3;PADARIA EXPRESS;Avenida das Comunicações 04, 4 - Industrial Anhangüera, Osasco;-23.4733709;-46.7741916
7840b1d1-8ee1-4f78-bb93-23469a756247;VIVIANNE ALVINO;Rua Benedito Américo de Oliveira, 325, LOJA 06 - Vila Yara, Osasco;-23.5481784;-46.7660251
2ec454a5-c565-479a-86d7-1e17a71b18e5;PIZZARIA VIENA;Rua São Jorge, 696 - Pestana, Osasco;-23.5383126;-46.8037391
5afdc6e5-5ac7-422a-88b6-c01961ff3ccc;CASA CARNES SANT MARIA;Avenida Ayrton Senna, 248 - Santa Maria, Osasco;-23.5828052;-46.8108952
28276b8f-16de-4915-a0d4-aa8ae63d64e0;RESTAURANTE HARU;Rua Nossa Senhora de Fátima, 44 - Centro, Osasco;-23.5370522;-46.78044570000001
7bdab87d-983c-4323-b01a-da53e8ff1292;SUL NATIVA GOURMET;Avenida Braz Leme, 2115 - Santana, São Paulo;-23.5036843;-46.6400259
d0aa6dd8-8dbb-4af2-962f-47b5bb9c3513;PADARIA E CONFEITARIA DAS FLORES;Rua Gardênia, 275 - Jardim das Flores, Osasco;-23.5349925;-46.7931077
876912ac-c276-4c9b-9edb-4e42b70a4606;FAMILIA FESTAS;Avenida Presidente Médici, 2508 - Vila Menck, Osasco;-23.5063024;-46.7667114
f5040791-088c-4865-b7d3-4527f4568bee;PASTIFICIO CARASI;Rua dos Trilhos, 1539 - Mooca, São Paulo;-23.5539788;-46.5947286
c7193824-de9a-4b7b-97ce-c07ba80c4607;JOSE CLAUDIO NASCIMENTO SANTOS;Rua Treze de Setembro, 289 - Bussocaba, Osasco;-23.5614625;-46.7931976
23bd0d48-f4c1-44a2-8166-51e894815d61;QUERO MAIS MASSAS;Rua Vasco da Gama, 43 - Cipava, Osasco;-23.5456025;-46.6221074
c1b16219-ea35-4975-9fe1-08064a620138;AVEC AMOUR;Rua José Ermírio de Moraes, 120 - Santo Antônio, Osasco;-23.5530031;-46.7983517
d8cc137d-16a8-4fd0-948b-2952fcbcf174;RECANDO DO DAVILA;Rua Moacir Salles D'Ávila, 804A - Vila Menck, Osasco;-23.5021662;-46.762677
de46c356-d93d-4251-86f4-cbd1a66c9969;MERCADO M P A;Rua Irma Leonie Duquet, 98 - Jardim Alto Alegre (São Rafael), São Paulo;-23.6125063;-46.4273241
b8a8bb61-9b1e-42da-9c9e-95a837c2d3a9;MUTINGA CENTER CARNES;Avenida Presidente Médici, 743 - Vila Menck, Osasco;-23.5020769;-46.7807395
faa23bcb-93a5-4e93-831f-045c18e14521;MERCADINHO IRMAOS MORELLI;Rua São Jorge, 254 - Pestana, Osasco;-23.5343169;-46.8042686
